{"$schema":"https://json-schema.org/draft/2020-12/schema","type":"object","required":["baseline_status","definition_level","production_status","frozen_decisions","prototype_hypotheses","open_validations","change_control"],"properties":{"baseline_status":{"const":"frozen_for_prototype"},"definition_level":{"const":"A"},"production_status":{"const":"blocked_pending_external_evidence"},"frozen_decisions":{"type":"array","minItems":1,"items":{"type":"string"}},"prototype_hypotheses":{"type":"array","minItems":1,"items":{"type":"string"}},"open_validations":{"type":"array","minItems":1,"items":{"type":"string"}},"change_control":{"const":"formal_decision_required"}},"additionalProperties":false}
